id,created_at,text
764119077732442112,2016-08-12 15:19:19,You can also listen to the first episode of With Her by streaming here: https://t.co/BVmjS8MFWn
764113674239901700,2016-08-12 14:57:51,"RT @maxlinsky: I'm doing a new podcast that will run through Election Day and @hillaryclinton is my co-host 
 https://t.co/FhBROuw0zy"
764105343978930176,2016-08-12 14:24:45,"🎧 Just launched: With Her, our official campaign podcast. Subscribe and listen to Episode 1: https://t.co/IIzDVOt3r4"
764072221933318144,2016-08-12 12:13:08,"Why is @realDonaldTrump refusing to release his tax returns? Some ideas:
https://t.co/M4MSBo6c9O"
763906007600803840,2016-08-12 01:12:39,".@TeamUSA at the White House, circa 2000. #TBT
https://t.co/cix9dny7PU"
763873378897985536,2016-08-11 23:03:00,"Congrats on bringing home the gold and silver, Simone and Aly. We’re all so proud of you! -H https://t.co/oqYrHXmZTH"
763845551628574720,2016-08-11 21:12:25,"Trump wants America to work for him and his friends.

We need to build an economy that works for everyone.
https://t.co/p0bpzITUpv"
763837665246576640,2016-08-11 20:41:05,RT @HFA: The choice on climate change couldn't be more stark: https://t.co/K745PdjVmW. https://t.co/us7OyJcdx4
763827045503737860,2016-08-11 19:58:53,It's not just a value—it's a real plan. https://t.co/OvGzoPTtwg https://t.co/hI6Ip27HHm
763817323476180997,2016-08-11 19:20:15,RT @mpshapiro: .@HillaryClinton hits the Trump Loophole - his backdoor tax break for billionaires like himself. Read about it here: https:/…
763804911758893056,2016-08-11 18:30:56,Let’s go out and build the future. https://t.co/OvGzoPTtwg
763803468347928577,2016-08-11 18:25:12,"""One of the reasons I asked Tim Kaine to be my running mate is that he...has a record of working across the aisle."" https://t.co/CNwtLVWl8n"
763802816762802176,2016-08-11 18:22:36,"Strengthening unions doesn’t just serve their members—it leads to better pay, benefits, and working conditions for all employees."
763801168950820868,2016-08-11 18:16:04,"Trump wants to give trillions in tax breaks to people like himself.

Instead, let’s invest in our veterans, kids, schools and police."
763800955573956608,2016-08-11 18:15:13,The 400 richest taxpayers in America would get an average tax cut of more than $15 million a year from the Trump loophole.
763800851693568001,2016-08-11 18:14:48,Trump wants to eliminate the estate tax. What that would mean: his family gets a $4 billion tax cut. 99.8% of Americans get nothing.
763800602837123072,2016-08-11 18:13:49,"Trump would give trillions in tax cuts to big corporations, millionaires, and Wall Street money managers. https://t.co/tymag0QkLx"
763800264939888640,2016-08-11 18:12:28,Multi-millionaires should not be able to pay a lower tax rate than their secretaries: https://t.co/XFX93S1Vgh
763799783999991808,2016-08-11 18:10:33,"Every employee, from the CEO suite to the factory floor, contributes to a business’ success, so everybody should share in the rewards."
763799532874399744,2016-08-11 18:09:34,"One positive thing Trump could do to make America great again?

Actually make great things in America: https://t.co/lg8Xqwblam"
763799303831822336,2016-08-11 18:08:39,"If @TeamUSA was as fearful as Trump, Michael Phelps and Simone Biles would be cowering in the locker room.

America isn’t afraid to compete."
763799123116064768,2016-08-11 18:07:56,"Trump may talk a big game on trade, but his approach is based on fear, not strength—fear that we can’t compete with the rest of the world."
763798669971886080,2016-08-11 18:06:08,"""As president, I will stand up to China and anyone else who tries to take advantage of American workers and companies."" —Hillary"
763798465746968576,2016-08-11 18:05:19,We’re going to invest in union training programs and apprenticeship programs so you can earn while you learn: https://t.co/sbbiIqIz0c
763797895111933952,2016-08-11 18:03:03,"A four-year degree shouldn’t be the only path to a good job. You should be able to learn a skill, practice a trade, and make a good living."
763797656846102529,2016-08-11 18:02:06,"It’s not right that Donald Trump can ignore his debts, but students and families can’t refinance theirs."
763797484699283456,2016-08-11 18:01:25,Let’s fight to make college tuition-free for the middle class and debt-free for everyone: https://t.co/BNZJ6ScplY
763797117391560704,2016-08-11 17:59:58,"The people taking care of our children and our parents deserve a good wage, good benefits, and a secure retirement."
763796425037713408,2016-08-11 17:57:13,Donald Trump has spent his whole career stiffing small businesses. https://t.co/i51CBQ9lKM
763795918936236032,2016-08-11 17:55:12,We’re going to invest $10 billion in “Make it in America” partnerships to support American manufacturing: https://t.co/21iaJ5hq7X
763795811771777024,2016-08-11 17:54:46,"""Some country is going to be the clean energy superpower of the 21st century and create millions of jobs...I want it to be us."" —Hillary"
763795154566320132,2016-08-11 17:52:10,"Starting on day one, we will work with both parties to pass the biggest investment in new, good-paying jobs since World War II."
763794635206582272,2016-08-11 17:50:06,One of the many stark choices we face in this election. https://t.co/sCQJXB7mEV
763794244964347904,2016-08-11 17:48:33,"Every American willing to work hard should be able to find a job that provides dignity, pride, and decent pay that can support a family."
763793648504938496,2016-08-11 17:46:11,"We are resilient, determined, and hard-working. There’s nothing America can’t do if we do it together."
763793285219438592,2016-08-11 17:44:44,"When Trump visited Detroit on Monday he talked only of failure, poverty, and crime.

He’s missing so much about what makes Michigan great."
763792253190041600,2016-08-11 17:40:38,Hillary is speaking live from Detroit on the economy. Don’t miss it. Tune in now: https://t.co/YgVauYf0Ol
763786270237687808,2016-08-11 17:16:51,"Anyone willing to sink so low, so often should never be allowed to serve as our Commander-in-Chief."
763786048702967808,2016-08-11 17:15:59,"No, Barack Obama is not the founder of ISIS."
763785696041730049,2016-08-11 17:14:35,"It can be difficult to muster outrage as frequently as Donald Trump should cause it, but his smear against President Obama requires it."
763779605325029376,2016-08-11 16:50:22,RT @TheBriefing2016: Donald Trump’s tax plan mostly helps...Donald Trump. And people like him at the top. https://t.co/5luTzXmZDP
763773523680722944,2016-08-11 16:26:12,1979. https://t.co/VYTglhPyfO
763742392503730176,2016-08-11 14:22:30,"Unlike Donald Trump's, our campaign is about issues—not insults. https://t.co/puVZP5iFRE https://t.co/pB0DcV1TeP"
763565546512248832,2016-08-11 02:39:47,My heart breaks for the family of the officer killed in Arkansas today. Grateful for his service to his community. -H
763540143034609667,2016-08-11 00:58:50,"Our kids see the president as a role model. How will they see Donald Trump?
https://t.co/xOxe3LdL70"
763525720408727552,2016-08-11 00:01:32,"Who benefits from Donald Trump's ""new"" economic plan? Rich people like Donald Trump. https://t.co/fDTcHhgCbz"
763498205095006208,2016-08-10 22:12:11,"Young people face tough challenges, but they have the ability to do something about it: Vote. https://t.co/dm98k71nf1"
763495402729504768,2016-08-10 22:01:03,We're also going to make sure future generations inherit a cleaner planet—and create millions of jobs along the way. https://t.co/HvrbycAnAy
763492199480918016,2016-08-10 21:48:20,Let's make it easier for young people to start businesses and fulfill their dreams. https://t.co/cJzNCnaahh https://t.co/vZHW9VZKDT
763489695439450112,2016-08-10 21:38:23,"And, unlike @realDonaldTrump, we're gonna make it easier for people who *aren't* celebrities to get apprenticeships. https://t.co/SdCUIITwuY"
763486995448532992,2016-08-10 21:27:39,Young Americans have the most to gain from Hillary's economic plan—and the most to lose under Trump's policies. https://t.co/V1u6kLTjNy
763484156827471873,2016-08-10 21:16:22,"When you dig deeper, you see that young people of color have faced even greater challenges. That has to change. https://t.co/8mpMkHn2sH"
763481807425773568,2016-08-10 21:07:02,Young people were among the hardest hit during the great recession—and the effects still linger. https://t.co/XFIZKrCHxF
763462413094096896,2016-08-10 19:49:58,Imagine how you'll feel the day after the election if we haven't joined together to chart a course of optimism. https://t.co/tTgeqxNqYm
763460795644641280,2016-08-10 19:43:32,"""I am humbled and moved by the Republicans who are willing to stand up and say that Donald Trump does not represent their values.” —Hillary"
763460083313434625,2016-08-10 19:40:42,"Donald Trump has spent his career stiffing small businesses, refusing to pay them what they’re owed. https://t.co/un2YiRLEYF"
763459929143410689,2016-08-10 19:40:06,"RT @HillaryforIA: “When they have student debt, we’ll put a three year moratory on that so they can start their own businesses!”—@HillaryCl…"
763459256054145024,2016-08-10 19:37:25,We can be the clean energy superpower of the 21st Century. https://t.co/Zb8w0tLYkS
763458963975340032,2016-08-10 19:36:16,We are living off of the infrastructure built by our parents and grandparents. It’s overdue for upgrades: https://t.co/KjhFN0QS2c
763458289149575168,2016-08-10 19:33:35,We’re going to make the biggest investment in good-paying jobs since World War II: https://t.co/NC6FHkl53y
763457118578114561,2016-08-10 19:28:56,Hillary's talking about the economy in Des Moines. Tune in now to watch: https://t.co/5VPr9qVgkv
763435041628315648,2016-08-10 18:01:12,"If you're a millionaire, you'll do great under Trump's economic plan. Everyone else? Well...

Take a look: https://t.co/zavnOS2RdL"
763420047004037120,2016-08-10 17:01:37,"""The time has come for Republicans...to repudiate Mr. Trump once and for all."" —@nytimes https://t.co/yMKCpKMC4l"
763386482312744960,2016-08-10 14:48:15,RT @timkaine: David's letter to his daughter about why he can't support Donald Trump really hits home. https://t.co/uyDaDdcpab
763167527933386752,2016-08-10 00:18:12,"Our kids are watching, Donald.
https://t.co/yRnhmfHIWh"
763153087733301248,2016-08-09 23:20:49,"RT @GabbyGiffords: .@realDonaldTrump might astound Americans on a routine basis, but we must draw a line between political speech &amp; suggest…"
763128923639152640,2016-08-09 21:44:48,"RT @HillaryforIA: Welcome back, Madame Secretary.

Hillary heads back to Des Moines this Wednesday. RSVP: https://t.co/cwo0OodC6J. https://…"
763103518773436416,2016-08-09 20:03:51,"""A person seeking to be the President of the United States should not suggest violence in any way."" https://t.co/Uu55CBCqdK"
763090844169764866,2016-08-09 19:13:29,Here’s the sad truth: There is no other Donald Trump. This is it. https://t.co/XNDh0d5csA
763064363355869184,2016-08-09 17:28:15,How can we prevent the spread of Zika in the U.S.? Hillary and @TimKaine respond on @Quora: https://t.co/ncuMmTCrSN https://t.co/ZeQOgVVxhX
763032112689623040,2016-08-09 15:20:06,"Donald Trump's economic plan is a bad deal for working families—and a big tax cut for Donald Trump.
https://t.co/D0oOe6bwza"
763017900449947649,2016-08-09 14:23:38,"Trump's trickle-down economic plan: big giveaways for those at the top at the expense of everyone else.
https://t.co/rXg4m7ulg4"
762836494566383617,2016-08-09 02:22:47,Thank you to the more than 2 million people who have donated to this campaign. Chip in now to join them: https://t.co/r3sF3mwlFX
762781269860188161,2016-08-08 22:43:21,RT @nytimes: 50 GOP officials sign a letter declaring that Trump “would be the most reckless president in American history” https://t.co/Qg…
762779867452760065,2016-08-08 22:37:46,RT @Quora: Presidential &amp; VP candidates @HillaryClinton &amp; @timkaine are now answering in their Session! https://t.co/jVxzCWBXX3 https://t.c…
762763375378071552,2016-08-08 21:32:14,RT @elizabethforma: Even @realDonaldTrump's childcare plan gives billionaires w/ a nanny a tax break while millions of low-income household…
762763288564367360,2016-08-08 21:31:54,RT @elizabethforma: .@realDonaldTrump's econ plan was written by rich corporate insider advisors to make the economy even greater for rich…
762747771246051328,2016-08-08 20:30:14,"Last night, swimmer @KatieLedecky won gold and broke her own world record in the 400m freestyle. Congrats, Katie! https://t.co/db79swBbOr"
762739172054601728,2016-08-08 19:56:04,Just imagine Donald Trump in the Oval Office facing a real crisis. We can’t afford that kind of risk.
762738782269476864,2016-08-08 19:54:31,Donald Trump is not only putting our national security at risk—he’s putting our economy at risk. https://t.co/HMiJtadxMF
762737799531462656,2016-08-08 19:50:37,We’re going to make sure the wealthy pay their fair share in taxes for a change: https://t.co/p7J6Ab1Agq
762737540470374400,2016-08-08 19:49:35,Donald Trump's plan is just a repackaging of trickle-down economics—and it doesn’t help our economy or the vast majority of Americans.
762736507279052801,2016-08-08 19:45:28,"We've got to stand up against climate deniers.

There isn't a problem we can't solve if we put our minds to it: https://t.co/2KQRq50PP8"
762734011869499393,2016-08-08 19:35:33,"Watch live as Hillary stops in St. Petersburg, Florida, for a campaign rally on the choice we face on the economy: https://t.co/09cW39nHXo"
762728277412806656,2016-08-08 19:12:46,RT @Quora: Answer by @HillaryClinton on her plans for her first 100 days in office if elected https://t.co/RQ50LwbmMU https://t.co/I8eEK6bk…
762721506547863552,2016-08-08 18:45:52,"Here's what people with actual ""tremendous business success"" say about Donald Trump. https://t.co/0T22CRcy2V"
762707643488202752,2016-08-08 17:50:47,RT @UAW: .@realDonaldTrump has an economic plan...to cut the pay of hardworking UAW members. https://t.co/IhIohjOtwq #NeverTrump
762699163368816641,2016-08-08 17:17:05,"RT @TheDemocrats: Creating jobs — it's what Democrats do. In 3 months, let's elect another one: https://t.co/qvnYQxtH0A https://t.co/ywlFN9…"
762689140513210368,2016-08-08 16:37:15,"RT @SenSanders: At a time of massive income and wealth inequality, it is absurd to provide huge tax breaks to the very rich."
762685400070709249,2016-08-08 16:22:24,"""Clinton’s economic policies...will result in a stronger U.S. economy.” —Mark Zandi, John McCain's economic advisor https://t.co/eLL6iQNEWY"
762677497691566081,2016-08-08 15:50:59,Today's bombing of a hospital in Pakistan is despicable. We have to stand up against terror and come together to prevent these attacks. -H
762675570937298944,2016-08-08 15:43:20,"In Rio, Olympic fencer Ibtihaj Muhammad became the first American Muslim athlete to compete while wearing a hijab. https://t.co/OrRSHnH2Ra"
762668316842401794,2016-08-08 15:14:31,"When you're comparing Hillary's and Trump's economic plans, there are two numbers you need to know. https://t.co/GdanBYOMUz"
762649724021272576,2016-08-08 14:00:38,"""I don't know another businessman that brags about his bankruptcies."" —@WarrenBuffett on Trump: https://t.co/Jx2p1D6UAd"
762623255005966336,2016-08-08 12:15:27,"Donald Trump's economic plan:
1. Lower wages
2. Fewer jobs 
3. More debt
4. Tax breaks for the 0.1%
https://t.co/OLU4htKlcV"
762485871350124545,2016-08-08 03:09:32,WATCH: This special 360 degree video allows you to experience the magic of the @DemConvention balloon drop: https://t.co/5DbAXK9yb8
762476184047198208,2016-08-08 02:31:03,"""She doesn't just see one America. She sees all of America &amp; knows that we need all of us."" —@CoryBooker on Hillary
https://t.co/EgkawPBAta"
762452870553702401,2016-08-08 00:58:24,We have some questions about @realDonaldTrump's cozy relationship with Russia. https://t.co/aetHzJyJCo
762415706453356545,2016-08-07 22:30:44,"In America, if you can dream it, you should be able to build it.
https://t.co/xduxyCcwj3"
762407211767308288,2016-08-07 21:56:58,RT @HFA: We're live on Facebook giving a demo of our Hillary for America mobile app. Tune in to get an inside look: https://t.co/0wuPE0hMcL.
762382229439930368,2016-08-07 20:17:42,"The NRA is based in Virginia, but that's never stopped @TimKaine from leading the fight to reduce gun violence. https://t.co/J9F086bQmo"
762376039741919232,2016-08-07 19:53:06,"RT @JoeBiden: No one wants to earn a Purple Heart. But to those who did, you have America's unending gratitude and admiration. Thank you. #…"
762370739152519169,2016-08-07 19:32:03,"Donald Trump's no good, horrible, very bad week. https://t.co/MtgwywgJ3q"
762361057394458624,2016-08-07 18:53:34,Laurie Hernandez is the first U.S.-born Latina on the Olympic gymnastics team since '84. Good luck! #ImWithHernandez https://t.co/C1S688jCt6
762345434014707712,2016-08-07 17:51:29,RT @BishopGarrison: Proud to celebrate Nat. Purple Heart Day today. Thank you to my fellow vets &amp; service members for your sacrifice. https…
762339357151924225,2016-08-07 17:27:20,"RT @HillaryforVA: In honor of our Weekend of Action, read why Jasmine Smalls (@ajazzyworld) is a proud member of Team #VirWINia. https://t.…"
762336483290251264,2016-08-07 17:15:55,"""She will deliver on the most important duty of a president—keeping our nation safe."" —Michael Morell on Hillary https://t.co/zmI3BOCH9Y"
762326407649329152,2016-08-07 16:35:53,"Three-time world all-around champion @Simone_Biles is set to make history at the Olympics. Good luck, Simone! https://t.co/JkiQ8hc1Xt"
762302466297827328,2016-08-07 15:00:45,"“On the issues, there’s no comparison in terms of thoughtfulness, thoroughness, and practicality."" —@HoustonChron https://t.co/hcFQLBYJfS"
762290625270075392,2016-08-07 14:13:42,"So proud of you, Karla.
https://t.co/iSQBiY8PyA"
762274629931134978,2016-08-07 13:10:08,"“#sendDonaldtospace” —@JeffBezos

Trump's peer reviews are dismal: https://t.co/AC4zW7KhrH"
762076523432116224,2016-08-07 00:02:56,45 reasons why Trump should never be president—just from this week alone. https://t.co/0cJ6fQeepR
762059962101198848,2016-08-06 22:57:08,"Seriously, what is going on with Trump and Russia? https://t.co/N6ySNILYMx"
762048829403389952,2016-08-06 22:12:53,"RT @barb_kinney: This is what I saw while photographing @HillaryClinton, @POTUS and more at the #DemConvention. https://t.co/jY0RO1XNJX"
762039821355327488,2016-08-06 21:37:06,"RT @timkaine: The right to vote is at the heart of our democracy, and a weakened VRA threatens that right for too many. It's time to #Resto…"
762030244584890368,2016-08-06 20:59:02,Why the @HoustonChron is urging voters to support Hillary in the “starkest political choice in living memory”: https://t.co/phjf19ybXr
762017792921051136,2016-08-06 20:09:34,Why do Trump’s foreign policy ideas read like a Putin wish list? https://t.co/IrJqXq0Kfg
762003451584745472,2016-08-06 19:12:34,Four years ago today. https://t.co/WPM1I9PPN3
762000226811011072,2016-08-06 18:59:46,"… so yeah, it's been quite a week for Donald Trump. https://t.co/UsexFeJjtl"
761995535389691904,2016-08-06 18:41:07,RT @HFA: Here's the story behind our campaign's first braille button: https://t.co/xbiY2gaPB5.
761958147602968576,2016-08-06 16:12:33,"RT @AmbassadorRice: Deeply concerned by raid on #ugpride2016. Many detained, incl. @Frankmugisha. LGBT citizens deserve protection. https:/…"
761956307054235648,2016-08-06 16:05:14,"America is stronger when we expand access to the ballot box, not restrict it. It's time to #RestoreTheVRA. https://t.co/uId57oQgUn"
761934268033540097,2016-08-06 14:37:40,"Four gold medals and counting: Today, @SerenaWilliams hits the court in Rio to add to her collection. https://t.co/iOMV0FH38S"
761714706532995072,2016-08-06 00:05:12,"At the Paris 1900 games, golfer Margaret Abbott became the first American woman to win an Olympic gold medal. https://t.co/kT9jIHvVu8"
761708660452122624,2016-08-05 23:41:11,RT @HFA: Ready for the opening ceremony. U.S.A! U.S.A! https://t.co/zcDofsiIcJ
761691520218955777,2016-08-05 22:33:04,"Trump just said he “doesn’t throw babies out” of his rallies...

Let’s review the record.
https://t.co/u3a8RDNNrr"
761670119458217984,2016-08-05 21:08:02,"""We have never had a candidate that was more qualified to take the office of president."" —@POTUS on Hillary https://t.co/EJ9xI5VQK7"
761653090307174401,2016-08-05 20:00:22,RT @JoeBiden: America is going to see what VP Biden already knows — just how much @HillaryClinton cares about our country. https://t.co/Oak…
761643508054712320,2016-08-05 19:22:17,"This week, Trump attacked a fallen soldier's family, called Hillary ""the devil,"" and criticized a crying baby.
https://t.co/UsexFf0UkT"
761630188811804672,2016-08-05 18:29:22,Stronger Together comes out in Sept—a book on Hillary's policy plans and vision for America: https://t.co/okQWnu725t https://t.co/lzyuvRstpt
761623652349546497,2016-08-05 18:03:23,"Republicans agree: We can't give Donald Trump control of our nuclear codes.
https://t.co/aVB6e5GbSm"
761610901178974208,2016-08-05 17:12:43,"""We have to reject and stand up against the appeals to the kind of bigotry...that we see from Trump’s campaign."" —Hillary #NABJNAHJ16"
761606730358849537,2016-08-05 16:56:09,RT @Hillary_esp: “Él dice que no se puede confiar en un distinguido juez porque tiene herencia mexicana”—Hillary sobre Trump.
761605038850596864,2016-08-05 16:49:25,"We launched an all-Spanish Twitter account, @Hillary_esp, because we believe in bringing as many people as possible into this conversation."
761604762030792704,2016-08-05 16:48:19,“I believe with all my heart that America is better than this. America is better than Donald Trump.” —Hillary
761604657521238016,2016-08-05 16:47:54,"Trump retweets white nationalists. 
He talks about banning Muslims. 
And yes, he talks about curtailing press freedom as well."
761604475752767490,2016-08-05 16:47:11,Trump is harkening back to the most shameful chapters of our history and appealing to the ugliest impulses of our society.
761604198312050689,2016-08-05 16:46:05,"It’s past time for comprehensive immigration reform, and we’re going to do everything we can to get it done: https://t.co/M3doGLY5rL"
761603383782412289,2016-08-05 16:42:51,"We’ve got to help every family afford the books, computers, and internet access that our kids need to learn in the 21st century."
761603088826396673,2016-08-05 16:41:40,Rosa Parks opened up every seat on the bus. Now we’ve got to expand economic opportunity so everyone can afford the fare.
761602482774675457,2016-08-05 16:39:16,"The Great Recession hit our whole country hard, but the toll was especially hard on black and Latino families."
761602061804900352,2016-08-05 16:37:36,Tune in to watch Hillary speak live with the @NABJ and the @NAHJ: https://t.co/nNYrAM60IC
761598819238813697,2016-08-05 16:24:42,"""Trump is not only unqualified for the job, but he may well pose a threat to our national security."" —Michael Morell https://t.co/zmI3BOCH9Y"
761590080104435712,2016-08-05 15:49:59,RT @WhiteHouse: Good news: Our businesses have added 15 million jobs over the past 77 months → https://t.co/C8P76l6bVB https://t.co/p0SH7Jn…
761583989077532674,2016-08-05 15:25:47,Our first-ever gold medal-winning women's gymnastics team: the Magnificent Seven. https://t.co/MVkhHBh7hI
761544914144403456,2016-08-05 12:50:31,"We don't know why Trump and Putin praise each other so much and share many foreign policies.

We'll let you guess.
https://t.co/N6ySNJ3zE5"
761399185258127360,2016-08-05 03:11:26,"Watch an exclusive interview with @POTUS backstage at the Democratic Convention.
https://t.co/EJ9xI5Eflx"
761351010728153089,2016-08-05 00:00:00,"None of us can raise a family, build a business, heal a community, or lift a country alone. It takes a village. https://t.co/wOdhhdd0pb"
761322212716609536,2016-08-04 22:05:34,"We know a guy with a binder, @realDonaldTrump. (He might not take your calls, though.) https://t.co/dxmFcISmaz"
761319791177109508,2016-08-04 21:55:57,"RT @CNNPolitics: Obama on whether Trump could be trusted with US nuclear weapons: ""Make your own judgment"" https://t.co/6OZtrfIwim https://…"
761319089822437376,2016-08-04 21:53:10,"RT @kenvogel: Obama: ""I obviously have very strong opinions about the two candidates running. One is very positive. The other one is not so…"
761315338285883392,2016-08-04 21:38:15,Wish @POTUS a happy birthday. Sign his card: https://t.co/YroKwbRvYX
761307468928462848,2016-08-04 21:06:59,"You saw the Democratic Convention.

Now, watch the never-before-seen footage from backstage:
https://t.co/mMjJFr02Wk"
761296750799908864,2016-08-04 20:24:24,"""If you're not registered, and you're eligible as an American citizen, please go sign up."" —Hillary in Nevada: https://t.co/tTgeqxNqYm"
761296469991256066,2016-08-04 20:23:17,Anyone who you can provoke with a tweet should not be anywhere near nuclear weapons: https://t.co/NLP0SRnuYt
761296210418397184,2016-08-04 20:22:15,"Donald Trump is not qualified to be president, and he is temperamentally unfit to be Commander-in-Chief."
761294965645385728,2016-08-04 20:17:18,"RT @HillaryforNV: ""We're going to work to make the biggest investment in new, good-paying jobs since World War II"" —Hillary https://t.co/6v…"
761272340747550721,2016-08-04 18:47:24,"Every week, @realDonaldTrump hits a new low. https://t.co/LBrTdE2n7v"
761263924901769220,2016-08-04 18:13:57,RT @TheBriefing2016: Most of Trump's merchandise is MADE IN (just about everywhere except) THE USA. https://t.co/A0d7fxyzXx
